HCI sniffer - Bluetooth packet analyzer ver 2.0
device: hci0 snap_len: 1028 filter: 0xffffffffffffffff
> HCI Event: Command Complete (0x0e) plen 4
    Write Class of Device (0x03|0x0024) ncmd 1
    status 0x00
< HCI Command: Write Scan Enable (0x03|0x001a) plen 1
    enable 3
> HCI Event: Command Complete (0x0e) plen 4
    Write Scan Enable (0x03|0x001a) ncmd 1
    status 0x00
< HCI Command: Read Scan Enable (0x03|0x0019) plen 0
> HCI Event: Command Complete (0x0e) plen 5
    Read Scan Enable (0x03|0x0019) ncmd 1
    status 0x00 enable 3
> HCI Event: Connect Request (0x04) plen 10
    bdaddr 00:25:00:53:33:64 class 0x38010c type ACL
< HCI Command: Accept Connection Request (0x01|0x0009) plen 7
    bdaddr 00:25:00:53:33:64 role 0x00
    Role: Master
> HCI Event: Command Status (0x0f) plen 4
    Accept Connection Request (0x01|0x0009) status 0x00 ncmd 1
> HCI Event: Role Change (0x12) plen 8
    status 0x00 bdaddr 00:25:00:53:33:64 role 0x00
    Role: Master
> HCI Event: Max Slots Change (0x1b) plen 3
    handle 11 slots 5
> HCI Event: Connect Complete (0x03) plen 11
    status 0x00 handle 11 bdaddr 00:25:00:53:33:64 type ACL encrypt 0x00
< HCI Command: Read Remote Supported Features (0x01|0x001b) plen 2
    handle 11
> ACL data: handle 11 flags 0x02 dlen 12
    L2CAP(s): Connect req: psm 1 scid 0x0040
< ACL data: handle 11 flags 0x02 dlen 16
    L2CAP(s): Connect rsp: dcid 0x0040 scid 0x0040 result 1 status 0
      Connection pending - No futher information available
< ACL data: handle 11 flags 0x02 dlen 10
    L2CAP(s): Info req: type 2
> HCI Event: Command Status (0x0f) plen 4
    Read Remote Supported Features (0x01|0x001b) status 0x00 ncmd 1
> HCI Event: Read Remote Supported Features (0x0b) plen 11
    status 0x00 handle 11
    Features: 0xff 0xff 0x8f 0xfe 0x9b 0xff 0x79 0x83
< HCI Command: Read Remote Extended Features (0x01|0x001c) plen 3
    handle 11 page 1
> HCI Event: Command Status (0x0f) plen 4
    Read Remote Extended Features (0x01|0x001c) status 0x00 ncmd 1
> ACL data: handle 11 flags 0x02 dlen 16
    L2CAP(s): Info rsp: type 2 result 0
      Extended feature mask 0x0000
> HCI Event: Number of Completed Packets (0x13) plen 5
    handle 11 packets 2
< ACL data: handle 11 flags 0x02 dlen 16
    L2CAP(s): Connect rsp: dcid 0x0040 scid 0x0040 result 0 status 0
      Connection successful
< ACL data: handle 11 flags 0x02 dlen 12
    L2CAP(s): Config req: dcid 0x0040 flags 0x00 clen 0
> HCI Event: Read Remote Extended Features (0x23) plen 13
    status 0x00 handle 11 page 1 max 1
    Features: 0x01 0x00 0x00 0x00 0x00 0x00 0x00 0x00
> ACL data: handle 11 flags 0x02 dlen 16
    L2CAP(s): Config req: dcid 0x0040 flags 0x00 clen 4
      MTU 65535 
< ACL data: handle 11 flags 0x02 dlen 18
    L2CAP(s): Config rsp: scid 0x0040 flags 0x00 result 0 clen 4
      MTU 65535 
> HCI Event: Number of Completed Packets (0x13) plen 5
    handle 11 packets 2
> ACL data: handle 11 flags 0x02 dlen 14
    L2CAP(s): Config rsp: scid 0x0040 flags 0x00 result 0 clen 0
      Success
> ACL data: handle 11 flags 0x02 dlen 24
    L2CAP(d): cid 0x0040 len 20 [psm 1]
        SDP SSA Req: tid 0x0 len 0xf
          pat uuid-16 0x1115 (PANU)
          max 65535
          aid(s) 0x0000 - 0xffff
          cont 00
< ACL data: handle 11 flags 0x02 dlen 14
    L2CAP(d): cid 0x0040 len 10 [psm 1]
        SDP SSA Rsp: tid 0x0 len 0x5
          count 2
          cont 00
> HCI Event: Number of Completed Packets (0x13) plen 5
    handle 11 packets 2
> ACL data: handle 11 flags 0x02 dlen 24
    L2CAP(d): cid 0x0040 len 20 [psm 1]
        SDP SSA Req: tid 0x1 len 0xf
          pat uuid-16 0x1116 (NAP)
          max 65535
          aid(s) 0x0000 - 0xffff
          cont 00
< ACL data: handle 11 flags 0x02 dlen 14
    L2CAP(d): cid 0x0040 len 10 [psm 1]
        SDP SSA Rsp: tid 0x1 len 0x5
          count 2
          cont 00
> ACL data: handle 11 flags 0x02 dlen 24
    L2CAP(d): cid 0x0040 len 20 [psm 1]
        SDP SSA Req: tid 0x2 len 0xf
          pat uuid-16 0x1117 (GN)
          max 65535
          aid(s) 0x0000 - 0xffff
          cont 00
< ACL data: handle 11 flags 0x02 dlen 14
    L2CAP(d): cid 0x0040 len 10 [psm 1]
        SDP SSA Rsp: tid 0x2 len 0x5
          count 2
          cont 00
> HCI Event: Number of Completed Packets (0x13) plen 5
    handle 11 packets 2
> ACL data: handle 11 flags 0x02 dlen 24
    L2CAP(d): cid 0x0040 len 20 [psm 1]
        SDP SSA Req: tid 0x3 len 0xf
          pat uuid-16 0x1200 (PNPInfo)
          max 65535
          aid(s) 0x0000 - 0xffff
          cont 00
< ACL data: handle 11 flags 0x02 dlen 14
    L2CAP(d): cid 0x0040 len 10 [psm 1]
        SDP SSA Rsp: tid 0x3 len 0x5
          count 2
          cont 00
> ACL data: handle 11 flags 0x02 dlen 24
    L2CAP(d): cid 0x0040 len 20 [psm 1]
        SDP SSA Req: tid 0x4 len 0xf
          pat uuid-16 0x1103 (DUN)
          max 65535
          aid(s) 0x0000 - 0xffff
          cont 00
< ACL data: handle 11 flags 0x02 dlen 14
    L2CAP(d): cid 0x0040 len 10 [psm 1]
        SDP SSA Rsp: tid 0x4 len 0x5
          count 2
          cont 00
> HCI Event: Number of Completed Packets (0x13) plen 5
    handle 11 packets 2
> ACL data: handle 11 flags 0x02 dlen 24
    L2CAP(d): cid 0x0040 len 20 [psm 1]
        SDP SSA Req: tid 0x5 len 0xf
          pat uuid-16 0x1104 (IRMCSync)
          max 65535
          aid(s) 0x0000 - 0xffff
          cont 00
< ACL data: handle 11 flags 0x02 dlen 14
    L2CAP(d): cid 0x0040 len 10 [psm 1]
        SDP SSA Rsp: tid 0x5 len 0x5
          count 2
          cont 00
> ACL data: handle 11 flags 0x02 dlen 24
    L2CAP(d): cid 0x0040 len 20 [psm 1]
        SDP SSA Req: tid 0x6 len 0xf
          pat uuid-16 0x1101 (SP)
          max 65535
          aid(s) 0x0000 - 0xffff
          cont 00
< ACL data: handle 11 flags 0x02 dlen 14
    L2CAP(d): cid 0x0040 len 10 [psm 1]
        SDP SSA Rsp: tid 0x6 len 0x5
          count 2
          cont 00
> HCI Event: Number of Completed Packets (0x13) plen 5
    handle 11 packets 2
> ACL data: handle 11 flags 0x02 dlen 24
    L2CAP(d): cid 0x0040 len 20 [psm 1]
        SDP SSA Req: tid 0x7 len 0xf
          pat uuid-16 0x1105 (OBEXObjPush)
          max 65535
          aid(s) 0x0000 - 0xffff
          cont 00
< ACL data: handle 11 flags 0x02 dlen 14
    L2CAP(d): cid 0x0040 len 10 [psm 1]
        SDP SSA Rsp: tid 0x7 len 0x5
          count 2
          cont 00
> ACL data: handle 11 flags 0x02 dlen 24
    L2CAP(d): cid 0x0040 len 20 [psm 1]
        SDP SSA Req: tid 0x8 len 0xf
          pat uuid-16 0x1106 (OBEXObjTrnsf)
          max 65535
          aid(s) 0x0000 - 0xffff
          cont 00
< ACL data: handle 11 flags 0x02 dlen 14
    L2CAP(d): cid 0x0040 len 10 [psm 1]
        SDP SSA Rsp: tid 0x8 len 0x5
          count 2
          cont 00
> HCI Event: Number of Completed Packets (0x13) plen 5
    handle 11 packets 2
> ACL data: handle 11 flags 0x02 dlen 24
    L2CAP(d): cid 0x0040 len 20 [psm 1]
        SDP SSA Req: tid 0x9 len 0xf
          pat uuid-16 0x1108 (Headset)
          max 65535
          aid(s) 0x0000 - 0xffff
          cont 00
< ACL data: handle 11 flags 0x02 dlen 99
    L2CAP(d): cid 0x0040 len 95 [psm 1]
        SDP SSA Rsp: tid 0x9 len 0x5a
          count 87
          record #0
              aid 0x0000 (SrvRecHndl)
                 uint 0x10000
              aid 0x0001 (SrvClassIDList)
                 < uuid-16 0x1112 (Headset AG) uuid-16 0x1203 (Audio) >
              aid 0x0004 (ProtocolDescList)
                 < < uuid-16 0x0100 (L2CAP) > <
                 uuid-16 0x0003 (RFCOMM) uint 0xc > >
              aid 0x0005 (BrwGrpList)
                 < uuid-16 0x1002 (PubBrwsGrp) >
              aid 0x0009 (BTProfileDescList)
                 < < uuid-16 0x1108 (Headset) uint 0x102 > >
              aid 0x0100 (SrvName)
                 str "Headset Audio Gateway"
          cont 00
> ACL data: handle 11 flags 0x02 dlen 24
    L2CAP(d): cid 0x0040 len 20 [psm 1]
        SDP SSA Req: tid 0xa len 0xf
          pat uuid-16 0x111e (Handsfree)
          max 65535
          aid(s) 0x0000 - 0xffff
          cont 00
< ACL data: handle 11 flags 0x02 dlen 113
    L2CAP(d): cid 0x0040 len 109 [psm 1]
        SDP SSA Rsp: tid 0xa len 0x68
          count 101
          record #0
              aid 0x0000 (SrvRecHndl)
                 uint 0x10001
              aid 0x0001 (SrvClassIDList)
                 < uuid-16 0x111f (Handsfree AG) uuid-16 0x1203 (Audio) >
              aid 0x0004 (ProtocolDescList)
                 < < uuid-16 0x0100 (L2CAP) > <
                 uuid-16 0x0003 (RFCOMM) uint 0xd > >
              aid 0x0005 (BrwGrpList)
                 < uuid-16 0x1002 (PubBrwsGrp) >
              aid 0x0009 (BTProfileDescList)
                 < < uuid-16 0x111e (Handsfree) uint 0x105 > >
              aid 0x0100 (SrvName)
                 str "Hands-Free Audio Gateway"
              aid 0x0301 (SuppDataStoresList)
                 uint 0x1
              aid 0x0311 (SuppFeatures)
                 uint 0x0
          cont 00
> HCI Event: Number of Completed Packets (0x13) plen 5
    handle 11 packets 2
> ACL data: handle 11 flags 0x02 dlen 24
    L2CAP(d): cid 0x0040 len 20 [psm 1]
        SDP SSA Req: tid 0xb len 0xf
          pat uuid-16 0x1112 (Headset AG)
          max 65535
          aid(s) 0x0000 - 0xffff
          cont 00
< ACL data: handle 11 flags 0x02 dlen 99
    L2CAP(d): cid 0x0040 len 95 [psm 1]
        SDP SSA Rsp: tid 0xb len 0x5a
          count 87
          record #0
              aid 0x0000 (SrvRecHndl)
                 uint 0x10000
              aid 0x0001 (SrvClassIDList)
                 < uuid-16 0x1112 (Headset AG) uuid-16 0x1203 (Audio) >
              aid 0x0004 (ProtocolDescList)
                 < < uuid-16 0x0100 (L2CAP) > <
                 uuid-16 0x0003 (RFCOMM) uint 0xc > >
              aid 0x0005 (BrwGrpList)
                 < uuid-16 0x1002 (PubBrwsGrp) >
              aid 0x0009 (BTProfileDescList)
                 < < uuid-16 0x1108 (Headset) uint 0x102 > >
              aid 0x0100 (SrvName)
                 str "Headset Audio Gateway"
          cont 00
> ACL data: handle 11 flags 0x02 dlen 24
    L2CAP(d): cid 0x0040 len 20 [psm 1]
        SDP SSA Req: tid 0xc len 0xf
          pat uuid-16 0x111b (ImagingResp)
          max 65535
          aid(s) 0x0000 - 0xffff
          cont 00
< ACL data: handle 11 flags 0x02 dlen 14
    L2CAP(d): cid 0x0040 len 10 [psm 1]
        SDP SSA Rsp: tid 0xc len 0x5
          count 2
          cont 00
> HCI Event: Number of Completed Packets (0x13) plen 5
    handle 11 packets 2
> ACL data: handle 11 flags 0x02 dlen 24
    L2CAP(d): cid 0x0040 len 20 [psm 1]
        SDP SSA Req: tid 0xd len 0xf
          pat uuid-16 0x111a (Imaging)
          max 65535
          aid(s) 0x0000 - 0xffff
          cont 00
< ACL data: handle 11 flags 0x02 dlen 14
    L2CAP(d): cid 0x0040 len 10 [psm 1]
        SDP SSA Rsp: tid 0xd len 0x5
          count 2
          cont 00
> ACL data: handle 11 flags 0x02 dlen 24
    L2CAP(d): cid 0x0040 len 20 [psm 1]
        SDP SSA Req: tid 0xe len 0xf
          pat uuid-16 0x110b (AudioSink)
          max 65535
          aid(s) 0x0000 - 0xffff
          cont 00
< ACL data: handle 11 flags 0x02 dlen 14
    L2CAP(d): cid 0x0040 len 10 [psm 1]
        SDP SSA Rsp: tid 0xe len 0x5
          count 2
          cont 00
> HCI Event: Number of Completed Packets (0x13) plen 5
    handle 11 packets 2
> ACL data: handle 11 flags 0x02 dlen 24
    L2CAP(d): cid 0x0040 len 20 [psm 1]
        SDP SSA Req: tid 0xf len 0xf
          pat uuid-16 0x110a (AudioSource)
          max 65535
          aid(s) 0x0000 - 0xffff
          cont 00
< ACL data: handle 11 flags 0x02 dlen 14
    L2CAP(d): cid 0x0040 len 10 [psm 1]
        SDP SSA Rsp: tid 0xf len 0x5
          count 2
          cont 00
> ACL data: handle 11 flags 0x02 dlen 24
    L2CAP(d): cid 0x0040 len 20 [psm 1]
        SDP SSA Req: tid 0x10 len 0xf
          pat uuid-16 0x110e (AVRemote)
          max 65535
          aid(s) 0x0000 - 0xffff
          cont 00
< ACL data: handle 11 flags 0x02 dlen 172
    L2CAP(d): cid 0x0040 len 168 [psm 1]
        SDP SSA Rsp: tid 0x10 len 0xa3
          count 160
          record #0
              aid 0x0000 (SrvRecHndl)
                 uint 0x10002
              aid 0x0001 (SrvClassIDList)
                 < uuid-16 0x110c (AVRemTarget) >
              aid 0x0004 (ProtocolDescList)
                 < < uuid-16 0x0100 (L2CAP) uint 0x17 > <
                 uuid-16 0x0017 (AVCTP) uint 0x103 > >
              aid 0x0005 (BrwGrpList)
                 < uuid-16 0x1002 (PubBrwsGrp) >
              aid 0x0009 (BTProfileDescList)
                 < < uuid-16 0x110e (AVRemote) uint 0x103 > >
              aid 0x0100 (SrvName)
                 str "AVRCP TG"
              aid 0x0311 (SuppFeatures)
                 uint 0xf
          record #1
              aid 0x0000 (SrvRecHndl)
                 uint 0x10003
              aid 0x0001 (SrvClassIDList)
                 < uuid-16 0x110e (AVRemote) >
              aid 0x0004 (ProtocolDescList)
                 < < uuid-16 0x0100 (L2CAP) uint 0x17 > <
                 uuid-16 0x0017 (AVCTP) uint 0x103 > >
              aid 0x0005 (BrwGrpList)
                 < uuid-16 0x1002 (PubBrwsGrp) >
              aid 0x0009 (BTProfileDescList)
                 < < uuid-16 0x110e (AVRemote) uint 0x100 > >
              aid 0x0100 (SrvName)
                 str "AVRCP CT"
              aid 0x0311 (SuppFeatures)
                 uint 0xf
          cont 00
> HCI Event: Number of Completed Packets (0x13) plen 5
    handle 11 packets 2
> ACL data: handle 11 flags 0x02 dlen 24
    L2CAP(d): cid 0x0040 len 20 [psm 1]
        SDP SSA Req: tid 0x11 len 0xf
          pat uuid-16 0x1124 (HID)
          max 65535
          aid(s) 0x0000 - 0xffff
          cont 00
< ACL data: handle 11 flags 0x02 dlen 352
    L2CAP(d): cid 0x0040 len 348 [psm 1]
        SDP SSA Rsp: tid 0x11 len 0x157
          count 340
          record #0
              aid 0x0000 (SrvRecHndl)
                 uint 0x10004
              aid 0x0001 (SrvClassIDList)
                 < uuid-16 0x1124 (HID) >
              aid 0x0004 (ProtocolDescList)
                 < < uuid-16 0x0100 (L2CAP) uint 0x11 > <
                 uuid-16 0x0011 (HIDP) > >
              aid 0x0005 (BrwGrpList)
                 < uuid-16 0x1002 (PubBrwsGrp) >
              aid 0x0006 (LangBaseAttrIDList)
                 < uint 0x656e uint 0x6a uint 0x100 >
              aid 0x0009 (BTProfileDescList)
                 < < uuid-16 0x1124 (HID) uint 0x100 > >
              aid 0x000d (AdditionalProtocolDescLists)
                 < < < uuid-16 0x0100 (L2CAP) uint 0x13 > < uuid-16 0x0011 (HIDP) > > >
              aid 0x0100 (SrvName)
                 str "HID Keyboard"
              aid 0x0200 (VersionNumList)
                 uint 0x100
              aid 0x0201 (SrvDBState)
                 uint 0x111
              aid 0x0202 (unknown)
                 uint 0x40
              aid 0x0203 (unknown)
                 uint 0xd
              aid 0x0204 (unknown)
                 uint 0x1
              aid 0x0205 (unknown)
                 uint 0x1
              aid 0x0206 (unknown)
                 < < uint 0x22 str 05 01 09 06 a1 01 85 01 05 07 19 e0 29 e7 15 00 25 01 75 01 95 08 81 02 95 01 75 08 81 01 95 05 75 01 05 08 19 01 29 05 91 02 95 01 75 03 91 01 95 06 75 08 15 00 25 65 05 07 19 00 29 65 81 00 c0 09 02 a1 01 09 01 a1 00 85 02 05 09 19 01 29 05 15 00 25 01 95 05 75 01 81 02 95 01 75 03 81 01 05 01 09 30 09 31 09 38 15 81 25 7f 75 08 95 03 81 06 05 0c 0a 38 02 15 81 25 7f 75 08 95 01 81 06 c0 c0 > >
              aid 0x0207 (unknown)
                 < < uint 0x409 uint 0x100 > >
              aid 0x0208 (unknown)
                 uint 0x0
              aid 0x020a (unknown)
                 uint 0x1
              aid 0x020b (unknown)
                 uint 0x100
              aid 0x020c (unknown)
                 uint 0x1f40
              aid 0x020d (unknown)
                 uint 0x1
              aid 0x020e (unknown)
                 uint 0x1
          cont 00
> ACL data: handle 11 flags 0x02 dlen 38
    L2CAP(d): cid 0x0040 len 34 [psm 1]
        SDP SSA Req: tid 0x12 len 0x1d
          pat uuid-128 f0722e20-0f8b-4e90-8cc2-1b46f5f2efe2
          max 65535
          aid(s) 0x0000 - 0xffff
          cont 00
< ACL data: handle 11 flags 0x02 dlen 14
    L2CAP(d): cid 0x0040 len 10 [psm 1]
        SDP SSA Rsp: tid 0x12 len 0x5
          count 2
          cont 00
> HCI Event: Number of Completed Packets (0x13) plen 5
    handle 11 packets 2
> ACL data: handle 11 flags 0x02 dlen 24
    L2CAP(d): cid 0x0040 len 20 [psm 1]
        SDP SSA Req: tid 0x13 len 0xf
          pat uuid-16 0x0100 (L2CAP)
          max 65535
          aid(s) 0x0000 - 0xffff
          cont 00
< ACL data: handle 11 flags 0x02 dlen 694
    L2CAP(d): cid 0x0040 len 690 [psm 1]
        SDP SSA Rsp: tid 0x13 len 0x2ad
          count 682
          record #0
              aid 0x0000 (SrvRecHndl)
                 uint 0x10000
              aid 0x0001 (SrvClassIDList)
                 < uuid-16 0x1112 (Headset AG) uuid-16 0x1203 (Audio) >
              aid 0x0004 (ProtocolDescList)
                 < < uuid-16 0x0100 (L2CAP) > <
                 uuid-16 0x0003 (RFCOMM) uint 0xc > >
              aid 0x0005 (BrwGrpList)
                 < uuid-16 0x1002 (PubBrwsGrp) >
              aid 0x0009 (BTProfileDescList)
                 < < uuid-16 0x1108 (Headset) uint 0x102 > >
              aid 0x0100 (SrvName)
                 str "Headset Audio Gateway"
          record #1
              aid 0x0000 (SrvRecHndl)
                 uint 0x10001
              aid 0x0001 (SrvClassIDList)
                 < uuid-16 0x111f (Handsfree AG) uuid-16 0x1203 (Audio) >
              aid 0x0004 (ProtocolDescList)
                 < < uuid-16 0x0100 (L2CAP) > <
                 uuid-16 0x0003 (RFCOMM) uint 0xd > >
              aid 0x0005 (BrwGrpList)
                 < uuid-16 0x1002 (PubBrwsGrp) >
              aid 0x0009 (BTProfileDescList)
                 < < uuid-16 0x111e (Handsfree) uint 0x105 > >
              aid 0x0100 (SrvName)
                 str "Hands-Free Audio Gateway"
              aid 0x0301 (SuppDataStoresList)
                 uint 0x1
              aid 0x0311 (SuppFeatures)
                 uint 0x0
          record #2
              aid 0x0000 (SrvRecHndl)
                 uint 0x10002
              aid 0x0001 (SrvClassIDList)
                 < uuid-16 0x110c (AVRemTarget) >
              aid 0x0004 (ProtocolDescList)
                 < < uuid-16 0x0100 (L2CAP) uint 0x17 > <
                 uuid-16 0x0017 (AVCTP) uint 0x103 > >
              aid 0x0005 (BrwGrpList)
                 < uuid-16 0x1002 (PubBrwsGrp) >
              aid 0x0009 (BTProfileDescList)
                 < < uuid-16 0x110e (AVRemote) uint 0x103 > >
              aid 0x0100 (SrvName)
                 str "AVRCP TG"
              aid 0x0311 (SuppFeatures)
                 uint 0xf
          record #3
              aid 0x0000 (SrvRecHndl)
                 uint 0x10003
              aid 0x0001 (SrvClassIDList)
                 < uuid-16 0x110e (AVRemote) >
              aid 0x0004 (ProtocolDescList)
                 < < uuid-16 0x0100 (L2CAP) uint 0x17 > <
                 uuid-16 0x0017 (AVCTP) uint 0x103 > >
              aid 0x0005 (BrwGrpList)
                 < uuid-16 0x1002 (PubBrwsGrp) >
              aid 0x0009 (BTProfileDescList)
                 < < uuid-16 0x110e (AVRemote) uint 0x100 > >
              aid 0x0100 (SrvName)
                 str "AVRCP CT"
              aid 0x0311 (SuppFeatures)
                 uint 0xf
          record #4
              aid 0x0000 (SrvRecHndl)
                 uint 0x10004
              aid 0x0001 (SrvClassIDList)
                 < uuid-16 0x1124 (HID) >
              aid 0x0004 (ProtocolDescList)
                 < < uuid-16 0x0100 (L2CAP) uint 0x11 > <
                 uuid-16 0x0011 (HIDP) > >
              aid 0x0005 (BrwGrpList)
                 < uuid-16 0x1002 (PubBrwsGrp) >
              aid 0x0006 (LangBaseAttrIDList)
                 < uint 0x656e uint 0x6a uint 0x100 >
              aid 0x0009 (BTProfileDescList)
                 < < uuid-16 0x1124 (HID) uint 0x100 > >
              aid 0x000d (AdditionalProtocolDescLists)
                 < < < uuid-16 0x0100 (L2CAP) uint 0x13 > < uuid-16 0x0011 (HIDP) > > >
              aid 0x0100 (SrvName)
                 str "HID Keyboard"
              aid 0x0200 (VersionNumList)
                 uint 0x100
              aid 0x0201 (SrvDBState)
                 uint 0x111
              aid 0x0202 (unknown)
                 uint 0x40
              aid 0x0203 (unknown)
                 uint 0xd
              aid 0x0204 (unknown)
                 uint 0x1
              aid 0x0205 (unknown)
                 uint 0x1
              aid 0x0206 (unknown)
                 < < uint 0x22 str 05 01 09 06 a1 01 85 01 05 07 19 e0 29 e7 15 00 25 01 75 01 95 08 81 02 95 01 75 08 81 01 95 05 75 01 05 08 19 01 29 05 91 02 95 01 75 03 91 01 95 06 75 08 15 00 25 65 05 07 19 00 29 65 81 00 c0 09 02 a1 01 09 01 a1 00 85 02 05 09 19 01 29 05 15 00 25 01 95 05 75 01 81 02 95 01 75 03 81 01 05 01 09 30 09 31 09 38 15 81 25 7f 75 08 95 03 81 06 05 0c 0a 38 02 15 81 25 7f 75 08 95 01 81 06 c0 c0 > >
              aid 0x0207 (unknown)
                 < < uint 0x409 uint 0x100 > >
              aid 0x0208 (unknown)
                 uint 0x0
              aid 0x020a (unknown)
                 uint 0x1
              aid 0x020b (unknown)
                 uint 0x100
              aid 0x020c (unknown)
                 uint 0x1f40
              aid 0x020d (unknown)
                 uint 0x1
              aid 0x020e (unknown)
                 uint 0x1
          cont 00
> ACL data: handle 11 flags 0x02 dlen 12
    L2CAP(s): Disconn req: dcid 0x0040 scid 0x0040
< ACL data: handle 11 flags 0x02 dlen 12
    L2CAP(s): Disconn rsp: dcid 0x0040 scid 0x0040
> HCI Event: Number of Completed Packets (0x13) plen 5
    handle 11 packets 2
> HCI Event: Disconn Complete (0x05) plen 4
    status 0x00 handle 11 reason 0x13
    Reason: Remote User Terminated Connection
> HCI Event: Connect Request (0x04) plen 10
    bdaddr 00:25:00:53:33:64 class 0x38010c type ACL
< HCI Command: Accept Connection Request (0x01|0x0009) plen 7
    bdaddr 00:25:00:53:33:64 role 0x00
    Role: Master
> HCI Event: Command Status (0x0f) plen 4
    Accept Connection Request (0x01|0x0009) status 0x00 ncmd 1
> HCI Event: Role Change (0x12) plen 8
    status 0x00 bdaddr 00:25:00:53:33:64 role 0x00
    Role: Master
> HCI Event: Max Slots Change (0x1b) plen 3
    handle 11 slots 5
> HCI Event: Connect Complete (0x03) plen 11
    status 0x00 handle 11 bdaddr 00:25:00:53:33:64 type ACL encrypt 0x00
< HCI Command: Read Remote Supported Features (0x01|0x001b) plen 2
    handle 11
> HCI Event: Command Status (0x0f) plen 4
    Read Remote Supported Features (0x01|0x001b) status 0x00 ncmd 1
> HCI Event: Read Remote Supported Features (0x0b) plen 11
    status 0x00 handle 11
    Features: 0xff 0xff 0x8f 0xfe 0x9b 0xff 0x79 0x83
< HCI Command: Read Remote Extended Features (0x01|0x001c) plen 3
    handle 11 page 1
> HCI Event: Command Status (0x0f) plen 4
    Read Remote Extended Features (0x01|0x001c) status 0x00 ncmd 1
> HCI Event: Read Remote Extended Features (0x23) plen 13
    status 0x00 handle 11 page 1 max 1
    Features: 0x01 0x00 0x00 0x00 0x00 0x00 0x00 0x00
> HCI Event: IO Capability Response (0x32) plen 9
    bdaddr 00:25:00:53:33:64 capability 0x01 oob 0x00 auth 0x03
    Capability: DisplayYesNo (OOB data not present)
    Authentication: Dedicated Bonding (MITM Protection)
> HCI Event: IO Capability Request (0x31) plen 6
    bdaddr 00:25:00:53:33:64
< HCI Command: IO Capability Request Reply (0x01|0x002b) plen 9
    bdaddr 00:25:00:53:33:64 capability 0x01 oob 0x00 auth 0x03
    Capability: DisplayYesNo (OOB data not present)
    Authentication: Dedicated Bonding (MITM Protection)
> HCI Event: Command Complete (0x0e) plen 10
    IO Capability Request Reply (0x01|0x002b) ncmd 1
    status 0x00 bdaddr 00:25:00:53:33:64
> HCI Event: User Confirmation Request (0x33) plen 10
    bdaddr 00:25:00:53:33:64 passkey 330912
< HCI Command: User Confirmation Request Reply (0x01|0x002c) plen 6
    bdaddr 00:25:00:53:33:64
> HCI Event: Command Complete (0x0e) plen 10
    User Confirmation Request Reply (0x01|0x002c) ncmd 1
    status 0x00 bdaddr 00:25:00:53:33:64
> HCI Event: Simple Pairing Complete (0x36) plen 7
    status 0x00 bdaddr 00:25:00:53:33:64
> HCI Event: Link Key Notification (0x18) plen 23
    bdaddr 00:25:00:53:33:64 key 2075E2A7BF0D2A6C2C31853D06926E4F type 5
    Type: Authenticated Combination Key
> HCI Event: Encrypt Change (0x08) plen 4
    status 0x00 handle 11 encrypt 0x01
> ACL data: handle 11 flags 0x02 dlen 12
    L2CAP(s): Connect req: psm 17 scid 0x0040
< ACL data: handle 11 flags 0x02 dlen 16
    L2CAP(s): Connect rsp: dcid 0x0040 scid 0x0040 result 1 status 0
      Connection pending - No futher information available
< ACL data: handle 11 flags 0x02 dlen 10
    L2CAP(s): Info req: type 2
> HCI Event: Number of Completed Packets (0x13) plen 5
    handle 11 packets 2
> ACL data: handle 11 flags 0x02 dlen 16
    L2CAP(s): Info rsp: type 2 result 0
      Extended feature mask 0x0000
< ACL data: handle 11 flags 0x02 dlen 16
    L2CAP(s): Connect rsp: dcid 0x0040 scid 0x0040 result 0 status 0
      Connection successful
< ACL data: handle 11 flags 0x02 dlen 12
    L2CAP(s): Config req: dcid 0x0040 flags 0x00 clen 0
> HCI Event: Number of Completed Packets (0x13) plen 5
    handle 11 packets 2
> ACL data: handle 11 flags 0x02 dlen 16
    L2CAP(s): Config req: dcid 0x0040 flags 0x00 clen 4
      MTU 65535 
< ACL data: handle 11 flags 0x02 dlen 18
    L2CAP(s): Config rsp: scid 0x0040 flags 0x00 result 0 clen 4
      MTU 65535 
> ACL data: handle 11 flags 0x02 dlen 14
    L2CAP(s): Config rsp: scid 0x0040 flags 0x00 result 0 clen 0
      Success
> ACL data: handle 11 flags 0x02 dlen 12
    L2CAP(s): Connect req: psm 19 scid 0x0041
< ACL data: handle 11 flags 0x02 dlen 16
    L2CAP(s): Connect rsp: dcid 0x0041 scid 0x0041 result 0 status 0
      Connection successful
< ACL data: handle 11 flags 0x02 dlen 12
    L2CAP(s): Config req: dcid 0x0041 flags 0x00 clen 0
> HCI Event: Number of Completed Packets (0x13) plen 5
    handle 11 packets 2
> ACL data: handle 11 flags 0x02 dlen 16
    L2CAP(s): Config req: dcid 0x0041 flags 0x00 clen 4
      MTU 65535 
< ACL data: handle 11 flags 0x02 dlen 18
    L2CAP(s): Config rsp: scid 0x0041 flags 0x00 result 0 clen 4
      MTU 65535 
> ACL data: handle 11 flags 0x02 dlen 14
    L2CAP(s): Config rsp: scid 0x0041 flags 0x00 result 0 clen 0
      Success
> HCI Event: Number of Completed Packets (0x13) plen 5
    handle 11 packets 2
> ACL data: handle 11 flags 0x02 dlen 5
    L2CAP(d): cid 0x0040 len 1 [psm 17]
      HIDP: Set protocol: Report protocol
> ACL data: handle 11 flags 0x02 dlen 12
    L2CAP(s): Disconn req: dcid 0x0041 scid 0x0041
< ACL data: handle 11 flags 0x02 dlen 12
    L2CAP(s): Disconn rsp: dcid 0x0041 scid 0x0041
< ACL data: handle 11 flags 0x02 dlen 12
    L2CAP(s): Disconn req: dcid 0x0040 scid 0x0040
> ACL data: handle 11 flags 0x02 dlen 12
    L2CAP(s): Disconn req: dcid 0x0040 scid 0x0040
< ACL data: handle 11 flags 0x02 dlen 12
    L2CAP(s): Disconn rsp: dcid 0x0040 scid 0x0040
> HCI Event: Number of Completed Packets (0x13) plen 5
    handle 11 packets 2
> ACL data: handle 11 flags 0x02 dlen 12
    L2CAP(s): Disconn rsp: dcid 0x0040 scid 0x0040
> HCI Event: Number of Completed Packets (0x13) plen 5
    handle 11 packets 1
< HCI Command: Disconnect (0x01|0x0006) plen 3
    handle 11 reason 0x13
    Reason: Remote User Terminated Connection
> HCI Event: Command Status (0x0f) plen 4
    Disconnect (0x01|0x0006) status 0x00 ncmd 1
> HCI Event: Disconn Complete (0x05) plen 4
    status 0x00 handle 11 reason 0x16
    Reason: Connection Terminated by Local Host
